id,german,word_class,gender,plural,english,pronunciation,theme,antonym,example_de,example_en
"453","der Reis","Nomen","der","","rice","rice","Essen, Kochen & Restaurant","","Zum Hühnchen esse ich Reis.","With the chicken I eat rice."
"454","die Reise","Nomen","die","die Reisen","trip / journey / travel","ry-zeh","Reise, Verkehr & Mobilität","","Die Reise nach Italien war wunderbar.","The trip to Italy was wonderful."
"455","das Reisebüro","Nomen","das","die Reisebüros","travel agency","ry-zeh-bue-ro","Reise, Verkehr & Mobilität","","Im Reisebüro buche ich meinen Urlaub.","At the travel agency I book my vacation."
"456","der Reiseführer","Nomen","der","die Reiseführer","travel guide / guidebook","ry-zeh-fue-rer","Reise, Verkehr & Mobilität","","Im Reiseführer steht viel über die Stadt.","The guidebook has a lot about the city."
"457","reisen","Verb","","","to travel","ry-zen","Reise, Verkehr & Mobilität","","Ich reise gern mit dem Zug.","I like to travel by train."
"458","die Reparatur","Nomen","die","die Reparaturen","repair","re-pah-rah-toor","Basiswortschatz & Floskeln","","Die Reparatur des Autos war teuer.","The repair of the car was expensive."
"459","reparieren","Verb","","","to repair / to fix","re-pah-ree-ren","Allgemeine Aktivitäten & Verben","kaputtmachen","Kannst du mein Fahrrad reparieren?","Can you repair my bicycle?"
"460","das Restaurant","Nomen","das","die Restaurants","restaurant","res-to-rahnt","Essen, Kochen & Restaurant","","Heute Abend gehen wir ins Restaurant.","Tonight we're going to the restaurant."
"461","die Rezeption","Nomen","die","die Rezeptionen","reception / front desk","re-tsep-tsyon","Reise, Verkehr & Mobilität","","Den Schlüssel bekommen Sie an der Rezeption.","You get the key at the reception."
"462","richtig","Adjektiv","","","right / correct","rikh-tikh","Eigenschaften & Adjektive","falsch","Du hast alle Fragen richtig beantwortet.","You answered all the questions correctly."
"463","riechen","Verb","","","to smell","ree-khen","Allgemeine Aktivitäten & Verben","stinken","Die Blumen riechen sehr gut.","The flowers smell very good."
"464","ruhig","Adjektiv","","","quiet / calm / peaceful","roo-ikh","Eigenschaften & Adjektive","laut","Die Straße ist nachts sehr ruhig.","The street is very quiet at night."
"465","der Saft","Nomen","der","die Säfte","juice","zahft","Essen, Kochen & Restaurant","","Zum Frühstück trinke ich Saft.","For breakfast I drink juice."
"466","sagen","Verb","","","to say / to tell","zah-gen","Kommunikation, Medien & Sprache","schweigen","Kannst du das bitte noch einmal sagen?","Can you please say that again?"
"467","der Salat","Nomen","der","die Salate","salad / lettuce","zah-laht","Essen, Kochen & Restaurant","","Als Vorspeise nehme ich einen Salat.","As a starter I'll have a salad."
"468","das Salz","Nomen","das","","salt","zahlts","Essen, Kochen & Restaurant","der Zucker","Die Suppe braucht mehr Salz.","The soup needs more salt."
"469","die S-Bahn","Nomen","die","die S-Bahnen","suburban train / city train","es-bahn","Reise, Verkehr & Mobilität","das Auto","Ich fahre mit der S-Bahn zur Arbeit.","I take the city train to work."
"470","der Schalter","Nomen","der","die Schalter","counter / switch","shahl-ter","Basiswortschatz & Floskeln","","An Schalter drei bekommen Sie die Tickets.","At counter three you get the tickets."
"471","scheinen","Verb","","","to shine / to seem","shy-nen","Natur, Umwelt & Tiere","","Heute scheint die Sonne.","Today the sun is shining."
"472","schicken","Verb","","","to send","shik-ken","Allgemeine Aktivitäten & Verben","bekommen","Ich schicke dir ein Paket.","I'm sending you a parcel."
"473","das Schild","Nomen","das","die Schilder","sign / signboard","shilt","Basiswortschatz & Floskeln","","Das Schild zeigt den Weg zum Bahnhof.","The sign shows the way to the station."
"474","der Schinken","Nomen","der","die Schinken","ham","shing-ken","Essen, Kochen & Restaurant","","Ich esse ein Brötchen mit Schinken.","I'm eating a roll with ham."
"475","schlafen","Verb","","","to sleep","shlah-fen","Allgemeine Aktivitäten & Verben","aufwachen","Am Wochenende schlafe ich lange.","On the weekend I sleep in."
"476","schlecht","Adjektiv","","","bad / poor / sick","shlekht","Gefühle, Charakter & Meinung","gut","Heute ist das Wetter schlecht.","Today the weather is bad."
"477","schließen","Verb","","","to close / to shut","shlee-sen","Allgemeine Aktivitäten & Verben","öffnen","Bitte schließen Sie die Tür.","Please close the door."
"478","der Schluss","Nomen","der","die Schlüsse","end / conclusion","shloos","Basiswortschatz & Floskeln","der Anfang","Am Schluss des Films waren alle glücklich.","At the end of the movie everyone was happy."
"479","der Schlüssel","Nomen","der","die Schlüssel","key","shlues-sel","Wohnen, Haus & Haushalt","","Ich habe meinen Schlüssel verloren.","I have lost my key."
"480","schmecken","Verb","","","to taste","shmek-ken","Essen, Kochen & Restaurant","","Der Kuchen schmeckt sehr gut.","The cake tastes very good."
"481","schnell","Adjektiv","","","fast / quick","shnel","Eigenschaften & Adjektive","langsam","Das Auto fährt sehr schnell.","The car drives very fast."
"482","schon","Andere","","","already","shohn","Uhrzeit, Datum & Kalender","noch nicht","Es ist schon spät.","It's already late."
"483","der Schrank","Nomen","der","die Schränke","closet / cupboard / cabinet","shrahnk","Wohnen, Haus & Haushalt","","Die Teller sind im Schrank.","The plates are in the cupboard."
"484","schreiben","Verb","","","to write","shry-ben","Kommunikation, Medien & Sprache","lesen","Ich schreibe meiner Oma einen Brief.","I'm writing my grandma a letter."
"485","der Schuh","Nomen","der","die Schuhe","shoe","shoo","Einkaufen, Geld & Konsum","","Meine neuen Schuhe sind sehr bequem.","My new shoes are very comfortable."
"486","die Schule","Nomen","die","die Schulen","school","shoo-leh","Ausbildung, Schule & Studium","","Die Kinder gehen um acht Uhr in die Schule.","The children go to school at eight o'clock."
"487","schwer","Adjektiv","","","heavy / difficult / hard","shvair","Eigenschaften & Adjektive","leicht","Diese Aufgabe ist sehr schwer.","This task is very difficult."
"488","die Schwester","Nomen","die","die Schwestern","sister","shves-ter","Person, Familie & Beziehungen","der Bruder","Meine Schwester studiert in Wien.","My sister studies in Vienna."
"489","das Schwimmbad","Nomen","das","die Schwimmbäder","swimming pool","shvim-baht","Freizeit, Hobbys & Unterhaltung","","Im Sommer gehen wir oft ins Schwimmbad.","In summer we often go to the swimming pool."
"490","schwimmen","Verb","","","to swim","shvim-men","Freizeit, Hobbys & Unterhaltung","","Im See kann man gut schwimmen.","You can swim well in the lake."
"491","schön","Adjektiv","","","beautiful / nice","shurn","Eigenschaften & Adjektive","hässlich","Das Wetter ist heute schön.","The weather is nice today."
"492","der Schüler","Nomen","der","die Schüler","student / pupil (male)","shue-ler","Ausbildung, Schule & Studium","der Lehrer","Der Schüler macht seine Hausaufgaben.","The pupil is doing his homework."
"493","der See","Nomen","der","die Seen","lake","zey","Natur, Umwelt & Tiere","das Meer","Der See ist im Winter zugefroren.","The lake is frozen in winter."
"494","sehen","Verb","","","to see","zey-hen","Allgemeine Aktivitäten & Verben","","Ich sehe dich morgen.","I'll see you tomorrow."
"495","die Sehenswürdigkeit","Nomen","die","die Sehenswürdigkeiten","sight / tourist attraction","zey-hens-vuer-dikh-kite","Reise, Verkehr & Mobilität","","In Berlin gibt es viele Sehenswürdigkeiten.","In Berlin there are many sights."
"496","sehr","Adverb","","","very / much","zair","Basiswortschatz & Floskeln","wenig","Das Essen war sehr gut.","The food was very good."
"497","sein","Verb","","","to be","zine","Allgemeine Aktivitäten & Verben","","Ich bin heute sehr müde.","I'm very tired today."
"498","seit","Präposition","","","since / for","zite","Grammatik, Pronomen & Struktur","","Seit einer Woche habe ich Urlaub.","I've been on vacation for a week."
"499","selbstständig","Adjektiv","","","independent / self-employed","zelpst-shten-dikh","Arbeit, Beruf & Karriere","angestellt","Mein Bruder ist selbstständig.","My brother is self-employed."
"500","sich","Pronomen","","","oneself / himself / herself","zikh","Grammatik, Pronomen & Struktur","","Das Kind wäscht sich die Hände.","The child washes its hands."
"501","sich kümmern","Verb","","","to take care of / to look after","zikh kuem-mern","Allgemeine Aktivitäten & Verben","vernachlässigen","Ich kümmere mich um die Kinder.","I take care of the children."
"502","sie / Sie","Andere","","","she / they / you (formal)","zee","Grammatik, Pronomen & Struktur","er","Sie kommt aus Frankreich.","She comes from France."
"503","sitzen","Verb","","","to sit","zit-sen","Allgemeine Aktivitäten & Verben","stehen","Wir sitzen im Garten und trinken Kaffee.","We're sitting in the garden drinking coffee."
"504","so","Andere","","","so / like this / this way","zoh","Basiswortschatz & Floskeln","","Warum bist du so traurig?","Why are you so sad?"
"505","das Sofa","Nomen","das","die Sofas","sofa / couch","zoh-fah","Wohnen, Haus & Haushalt","","Am Abend sitze ich gern auf dem Sofa.","In the evening I like to sit on the sofa."
"506","sofort","Andere","","","immediately / right away","zoh-fort","Uhrzeit, Datum & Kalender","später","Komm bitte sofort her!","Please come here immediately!"
"507","der Sohn","Nomen","der","die Söhne","son","zohn","Person, Familie & Beziehungen","die Tochter","Mein Sohn ist fünf Jahre alt.","My son is five years old."
"508","sollen","Verb","","","should / to be supposed to","zol-len","Allgemeine Aktivitäten & Verben","","Was soll ich heute kochen?","What should I cook today?"
"509","die Sonne","Nomen","die","die Sonnen","sun","zon-neh","Natur, Umwelt & Tiere","der Mond","Die Sonne geht im Osten auf.","The sun rises in the east."
"510","die Speisekarte","Nomen","die","die Speisekarten","menu / menu card","shpy-zeh-kar-teh","Essen, Kochen & Restaurant","","Können Sie mir bitte die Speisekarte bringen?","Can you please bring me the menu?"
"511","spielen","Verb","","","to play","shpee-len","Freizeit, Hobbys & Unterhaltung","","Am Abend spielen wir gern Karten.","In the evening we like to play cards."
"512","der Sport","Nomen","der","","sports","shport","Freizeit, Hobbys & Unterhaltung","","Sport macht mir großen Spaß.","Sports are a lot of fun for me."
"513","die Sprache","Nomen","die","die Sprachen","language","shprah-kheh","Kommunikation, Medien & Sprache","","Deutsch ist eine schwere Sprache.","German is a difficult language."
"514","sprechen","Verb","","","to speak / to talk","shprekh-en","Kommunikation, Medien & Sprache","schweigen","Ich spreche ein bisschen Englisch.","I speak a little English."
"515","spät","Adjektiv","","","late","shpait","Uhrzeit, Datum & Kalender","früh","Es ist schon spät, ich gehe ins Bett.","It's already late, I'm going to bed."
"516","später","Andere","","","later","shpai-ter","Uhrzeit, Datum & Kalender","früher","Wir sehen uns später.","We'll see each other later."
"517","die Stadt","Nomen","die","die Städte","city / town","shtaht","Wohnen, Haus & Haushalt","das Dorf","Berlin ist eine große Stadt.","Berlin is a big city."
"518","stehen","Verb","","","to stand / to be located","shtey-hen","Allgemeine Aktivitäten & Verben","sitzen","An der Ecke steht eine Bank.","There is a bench on the corner."
"519","die Stelle","Nomen","die","die Stellen","job / position / place","shtel-leh","Arbeit, Beruf & Karriere","","Ich habe eine neue Stelle gefunden.","I have found a new job."
"520","stellen","Verb","","","to put / to place","shtel-len","Allgemeine Aktivitäten & Verben","legen","Stell die Flasche auf den Tisch.","Put the bottle on the table."
"521","der Stock","Nomen","der","die Stöcke","floor / story","shtok","Wohnen, Haus & Haushalt","","Meine Wohnung ist im dritten Stock.","My apartment is on the third floor."
"522","die Straße","Nomen","die","die Straßen","street / road","shtrah-seh","Reise, Verkehr & Mobilität","","Meine Wohnung ist in einer ruhigen Straße.","My apartment is on a quiet street."
"523","die Straßenbahn","Nomen","die","die Straßenbahnen","tram / streetcar","shtrah-sen-bahn","Reise, Verkehr & Mobilität","","Ich fahre mit der Straßenbahn ins Zentrum.","I take the tram to the center."
"524","der Student","Nomen","der","die Studenten","university student","shtoo-dent","Ausbildung, Schule & Studium","","Der Student lernt für die Prüfung.","The student is studying for the exam."
"525","studieren","Verb","","","to study (at university)","shtoo-dee-ren","Ausbildung, Schule & Studium","","Ich studiere Medizin in Berlin.","I study medicine in Berlin."
"526","das Studium","Nomen","das","die Studien","university studies / degree program","shtoo-dee-oom","Ausbildung, Schule & Studium","","Mein Studium dauert vier Jahre.","My studies last four years."
"527","die Stunde","Nomen","die","die Stunden","hour / lesson","shtoon-deh","Uhrzeit, Datum & Kalender","die Minute","Ich warte schon eine Stunde auf dich.","I've been waiting for you for an hour already."
"528","suchen","Verb","","","to search / to look for","zoo-khen","Allgemeine Aktivitäten & Verben","finden","Ich suche meine Brille.","I'm looking for my glasses."
"529","tanzen","Verb","","","to dance","tahnt-sen","Freizeit, Hobbys & Unterhaltung","","Auf der Party tanzen wir die ganze Nacht.","At the party we dance all night."
"530","die Tasche","Nomen","die","die Taschen","bag / pocket","tah-sheh","Einkaufen, Geld & Konsum","","Ich habe meinen Schlüssel in der Tasche.","I have my key in my bag."
"531","das Taxi","Nomen","das","die Taxis","taxi / cab","tahk-see","Reise, Verkehr & Mobilität","","Wir nehmen ein Taxi zum Flughafen.","We're taking a taxi to the airport."
"532","der Tee","Nomen","der","","tea","tay","Essen, Kochen & Restaurant","der Kaffee","Am Abend trinke ich gern Tee.","In the evening I like to drink tea."
"533","der Teil","Nomen","der","die Teile","part / section","tile","Basiswortschatz & Floskeln","das Ganze","Den ersten Teil des Films habe ich verpasst.","I missed the first part of the movie."
"534","das Telefon","Nomen","das","die Telefone","telephone / phone","te-le-fone","Kommunikation, Medien & Sprache","","Das Telefon klingelt.","The telephone is ringing."
"535","telefonieren","Verb","","","to make a phone call / to telephone","te-le-fo-nee-ren","Kommunikation, Medien & Sprache","","Ich telefoniere gerade mit meiner Mutter.","I'm on the phone with my mother right now."
"536","der Termin","Nomen","der","die Termine","appointment / date","ter-meen","Uhrzeit, Datum & Kalender","","Ich habe morgen einen Termin beim Zahnarzt.","Tomorrow I have a dentist appointment."
"537","der Test","Nomen","der","die Tests","test","test","Ausbildung, Schule & Studium","","Der Test war nicht schwer.","The test was not difficult."
"538","teuer","Adjektiv","","","expensive","toy-er","Einkaufen, Geld & Konsum","billig","Dieses Auto ist sehr teuer.","This car is very expensive."
"539","der Text","Nomen","der","die Texte","text","tekst","Ausbildung, Schule & Studium","","Lesen Sie bitte den Text laut.","Please read the text aloud."
"540","das Thema","Nomen","das","die Themen","topic / theme","tay-mah","Ausbildung, Schule & Studium","","Das Thema ist sehr interessant.","The topic is very interesting."
"541","das Ticket","Nomen","das","die Tickets","ticket","tik-et","Reise, Verkehr & Mobilität","","Ich habe das Ticket online gekauft.","I bought the ticket online."
"542","der Tisch","Nomen","der","die Tische","table","tish","Wohnen, Haus & Haushalt","","Das Essen steht schon auf dem Tisch.","The food is already on the table."
"543","die Tochter","Nomen","die","die Töchter","daughter","tokh-ter","Person, Familie & Beziehungen","der Sohn","Meine Tochter geht in die Schule.","My daughter goes to school."
"544","die Toilette","Nomen","die","die Toiletten","toilet / restroom","twa-let-teh","Basiswortschatz & Floskeln","","Wo ist bitte die Toilette?","Where is the toilet, please?"
"545","die Tomate","Nomen","die","die Tomaten","tomato","to-mah-teh","Essen, Kochen & Restaurant","","Im Salat sind Tomaten und Gurken.","In the salad there are tomatoes and cucumbers."
"546","tot","Adjektiv","","","dead","toht","Person, Familie & Beziehungen","lebendig","Die Pflanze ist leider tot.","Unfortunately, the plant is dead."
"547","die Treppe","Nomen","die","die Treppen","stairs / staircase","trep-peh","Wohnen, Haus & Haushalt","der Aufzug","Ich nehme die Treppe, nicht den Aufzug.","I'll take the stairs, not the elevator."
"548","trinken","Verb","","","to drink","tring-ken","Essen, Kochen & Restaurant","essen","Trinkst du gern Kaffee?","Do you like to drink coffee?"
"549","tschüss","Andere","","","bye / bye-bye","choos","Basiswortschatz & Floskeln","hallo","Tschüss, bis morgen!","Bye, see you tomorrow!"
"550","tun","Verb","","","to do","toon","Allgemeine Aktivitäten & Verben","","Das tut mir sehr leid.","I'm very sorry."
"551","die Uhr","Nomen","die","die Uhren","clock / watch / o'clock","oor","Uhrzeit, Datum & Kalender","","Wie viel Uhr ist es jetzt?","What time is it now?"
"552","um","Andere","","","at / around","oom","Grammatik, Pronomen & Struktur","","Der Film beginnt um acht Uhr.","The movie starts at eight o'clock."
"553","umziehen","Verb","","","to move (house)","oom-tsee-hen","Wohnen, Haus & Haushalt","","Nächsten Monat ziehen wir nach Berlin um.","Next month we're moving to Berlin."
"554","und","Andere","","","and","oont","Grammatik, Pronomen & Struktur","oder","Ich trinke Kaffee und esse ein Brötchen.","I drink coffee and eat a roll."
"555","unser-","Andere","","","our","oon-zer","Grammatik, Pronomen & Struktur","euer-","Das ist unser neues Auto.","That's our new car."
"556","unten","Andere","","","downstairs / below / at the bottom","oon-ten","Wohnen, Haus & Haushalt","oben","Die Schuhe stehen unten im Schrank.","The shoes are at the bottom of the cupboard."
"557","unter","Andere","","","under / below","oon-ter","Grammatik, Pronomen & Struktur","über","Die Katze liegt unter dem Tisch.","The cat is lying under the table."
"558","der Unterricht","Nomen","der","","class / lesson / instruction","oon-ter-rikht","Ausbildung, Schule & Studium","","Im Unterricht sprechen wir nur Deutsch.","In class we only speak German."
"559","unterschreiben","Verb","","","to sign","oon-ter-shry-ben","Staat, Gesellschaft & Dokumente","","Bitte unterschreiben Sie hier unten.","Please sign here at the bottom."
"560","die Unterschrift","Nomen","die","die Unterschriften","signature","oon-ter-shrift","Staat, Gesellschaft & Dokumente","","Setzen Sie bitte Ihre Unterschrift unter den Vertrag.","Please put your signature under the contract."
"561","der Urlaub","Nomen","der","die Urlaube","vacation / holiday","oor-lowp","Reise, Verkehr & Mobilität","die Arbeit","Im Sommer machen wir Urlaub in Spanien.","In summer we go on vacation in Spain."
"562","der Vater","Nomen","der","die Väter","father","fah-ter","Person, Familie & Beziehungen","die Mutter","Mein Vater arbeitet bei einer Bank.","My father works at a bank."
"563","verboten","Adjektiv","","","forbidden / prohibited","fer-bo-ten","Eigenschaften & Adjektive","erlaubt","Hier ist das Parken verboten.","Parking is forbidden here."
"564","verdienen","Verb","","","to earn","fer-dee-nen","Arbeit, Beruf & Karriere","ausgeben","In diesem Job verdiene ich gut.","I earn well in this job."
"565","der Verein","Nomen","der","die Vereine","club / association","fer-ine","Freizeit, Hobbys & Unterhaltung","","Mein Sohn ist in einem Fußballverein.","My son is in a soccer club."
"566","verheiratet","Adjektiv","","","married","fer-hy-rah-tet","Person, Familie & Beziehungen","ledig","Meine Schwester ist seit zwei Jahren verheiratet.","My sister has been married for two years."
"567","verkaufen","Verb","","","to sell","fer-kow-fen","Einkaufen, Geld & Konsum","kaufen","Ich möchte mein altes Auto verkaufen.","I want to sell my old car."
"568","der Verkäufer","Nomen","der","die Verkäufer","salesman / shop assistant","fer-koy-fer","Arbeit, Beruf & Karriere","der Kunde","Der Verkäufer ist sehr freundlich.","The salesman is very friendly."
"569","vermieten","Verb","","","to rent out / to let","fer-mee-ten","Wohnen, Haus & Haushalt","mieten","Wir vermieten ein Zimmer an Studenten.","We rent out a room to students."
"570","der Vermieter","Nomen","der","die Vermieter","landlord","fer-mee-ter","Wohnen, Haus & Haushalt","der Mieter","Der Vermieter wohnt im selben Haus.","The landlord lives in the same house."
"571","verstehen","Verb","","","to understand","fer-shtey-en","Kommunikation, Medien & Sprache","","Ich verstehe diese Frage nicht.","I don't understand this question."
"572","der Verwandte","Nomen","der","die Verwandten","relative","fer-vahn-teh","Person, Familie & Beziehungen","","Zu Weihnachten besuchen wir unsere Verwandten.","At Christmas we visit our relatives."
"573","viel","Andere","","","much / a lot","feel","Zahlen, Maße & Mengen","wenig","Ich habe heute viel Arbeit.","I have a lot of work today."
"574","vielleicht","Andere","","","maybe / perhaps","fee-lykht","Basiswortschatz & Floskeln","sicher","Vielleicht regnet es morgen.","Maybe it will rain tomorrow."
"575","von","Andere","","","from / of","fon","Grammatik, Pronomen & Struktur","zu","Das ist ein Geschenk von meiner Oma.","That's a present from my grandma."
"576","vor","Andere","","","before / in front of","for","Grammatik, Pronomen & Struktur","nach","Vor dem Essen wasche ich mir die Hände.","Before the meal I wash my hands."
"577","der Vorname","Nomen","der","die Vornamen","first name","for-nah-meh","Person, Familie & Beziehungen","der Familienname","Wie ist Ihr Vorname?","What is your first name?"
"578","die Vorsicht","Nomen","die","","caution / care","for-zikht","Basiswortschatz & Floskeln","","Vorsicht, der Boden ist nass!","Caution, the floor is wet!"
"579","die Vorwahl","Nomen","die","die Vorwahlen","area code / dialing code","for-vahl","Kommunikation, Medien & Sprache","","Wie ist die Vorwahl von Deutschland?","What is the area code of Germany?"
"580","wandern","Verb","","","to hike / to wander","vahn-dern","Freizeit, Hobbys & Unterhaltung","","Am Wochenende wandern wir in den Bergen.","On the weekend we hike in the mountains."
"581","wann","Andere","","","when","vahn","Uhrzeit, Datum & Kalender","","Wann beginnt der Film?","When does the movie start?"
"582","warten","Verb","","","to wait","var-ten","Allgemeine Aktivitäten & Verben","","Ich warte vor dem Kino auf dich.","I'm waiting for you in front of the cinema."
"583","warum","Andere","","","why","vah-room","Grammatik, Pronomen & Struktur","","Warum kommst du heute so spät?","Why are you so late today?"
"584","was","Andere","","","what","vahs","Grammatik, Pronomen & Struktur","","Was hast du am Wochenende gemacht?","What did you do on the weekend?"
"585","waschen","Verb","","","to wash","vah-shen","Gesundheit, Körper & Pflege","","Ich wasche meine Kleidung am Samstag.","I wash my clothes on Saturday."
"586","das Wasser","Nomen","das","","water","vahs-ser","Essen, Kochen & Restaurant","","Ich trinke jeden Tag viel Wasser.","I drink a lot of water every day."
"587","weg sein","Verb","","","to be gone / to be away","vek zine","Allgemeine Aktivitäten & Verben","da sein","Mein Geld ist plötzlich weg.","My money is suddenly gone."
"588","wehtun","Verb","","","to hurt / to ache","vey-toon","Gesundheit, Körper & Pflege","","Mein Rücken tut mir weh.","My back hurts."
"589","weiblich","Adjektiv","","","female / feminine","vybe-likh","Person, Familie & Beziehungen","männlich","Ist das Wort weiblich?","Is the word feminine?"
"590","der Wein","Nomen","der","die Weine","wine","vine","Essen, Kochen & Restaurant","das Wasser","Zum Abendessen trinken wir Wein.","With dinner we drink wine."
"591","weit","Adjektiv","","","far / wide","vite","Reise, Verkehr & Mobilität","nah","Ist es noch weit bis zum Bahnhof?","Is it still far to the station?"
"592","weiter","Andere","","","further / on","vy-ter","Reise, Verkehr & Mobilität","zurück","Bitte lesen Sie weiter.","Please continue reading."
"593","welch-","Andere","","","which","velkh","Grammatik, Pronomen & Struktur","","Welches Buch liest du gerade?","Which book are you reading right now?"
"594","die Welt","Nomen","die","die Welten","world","velt","Basiswortschatz & Floskeln","","Ich möchte die ganze Welt sehen.","I want to see the whole world."
"595","wenig","Adjektiv","","","little / few","vey-nikh","Zahlen, Maße & Mengen","viel","Ich habe nur wenig Zeit.","I have only little time."
"596","wer","Andere","","","who","vair","Grammatik, Pronomen & Struktur","","Wer ist die Frau dort?","Who is the woman over there?"
"597","werden","Verb","","","to become / to get","vair-den","Allgemeine Aktivitäten & Verben","bleiben","Im Frühling wird das Wetter wärmer.","In spring the weather becomes warmer."
"598","das Wetter","Nomen","das","","weather","vet-ter","Natur, Umwelt & Tiere","","Wie ist das Wetter heute?","What's the weather like today?"
"599","wichtig","Adjektiv","","","important","vikh-tikh","Eigenschaften & Adjektive","unwichtig","Diese Information ist sehr wichtig.","This information is very important."
"600","wie","Andere","","","how / as / like","vee","Grammatik, Pronomen & Struktur","","Wie geht es dir heute?","How are you today?"
"601","wie viel","Andere","","","how much / how many","vee feel","Zahlen, Maße & Mengen","","Wie viel kostet das Brot?","How much does the bread cost?"
"602","wiederholen","Verb","","","to repeat","vee-der-ho-len","Allgemeine Aktivitäten & Verben","","Bitte wiederhole den Satz langsam.","Please repeat the sentence slowly."
"603","das Wiederhören","Nomen","das","","goodbye (on the phone)","vee-der-hur-en","Basiswortschatz & Floskeln","","Vielen Dank für den Anruf, auf Wiederhören!","Thank you for the call, goodbye!"
