id,german,word_class,gender,plural,english,pronunciation,theme,antonym,example_de,example_en
"299","ja","Andere","","","yes","yah","Basiswortschatz & Floskeln","nein","Ja, das stimmt.","Yes, that's right."
"300","die Jacke","Nomen","die","die Jacken","jacket","yah-keh","Einkaufen, Geld & Konsum","","Zieh deine Jacke an, es ist kalt.","Put on your jacket, it's cold."
"301","jed-","Andere","","","every / each","yey-deh","Grammatik, Pronomen & Struktur","kein-","Jeden Morgen trinke ich einen Kaffee.","Every morning I drink a coffee."
"302","jetzt","Andere","","","now","yetst","Uhrzeit, Datum & Kalender","später","Wir müssen jetzt gehen.","We have to go now."
"303","der Job","Nomen","der","die Jobs","job","job","Arbeit, Beruf & Karriere","","Ich suche einen neuen Job.","I'm looking for a new job."
"304","der Jugendliche","Nomen","der","die Jugendlichen","youth / teenager","yoo-gent-likh-eh","Person, Familie & Beziehungen","der Erwachsene","Viele Jugendliche spielen hier Fußball.","Many teenagers play soccer here."
"305","jung","Adjektiv","","","young","yoong","Eigenschaften & Adjektive","alt","Sie ist noch sehr jung.","She is still very young."
"306","der Junge","Nomen","der","die Jungen","boy","yoong-eh","Person, Familie & Beziehungen","das Mädchen","Der Junge spielt mit dem Ball.","The boy is playing with the ball."
"307","der Kaffee","Nomen","der","","coffee","kah-fey","Essen, Kochen & Restaurant","der Tee","Möchten Sie einen Kaffee?","Would you like a coffee?"
"308","kaputt","Adjektiv","","","broken","kah-poot","Eigenschaften & Adjektive","ganz","Meine Uhr ist kaputt.","My watch is broken."
"309","die Karte","Nomen","die","die Karten","card / ticket / menu","kar-teh","Basiswortschatz & Floskeln","","Ich habe zwei Karten für das Konzert.","I have two tickets for the concert."
"310","die Kartoffel","Nomen","die","die Kartoffeln","potato","kar-tof-fel","Essen, Kochen & Restaurant","","Zum Mittagessen gibt es Kartoffeln.","For lunch there are potatoes."
"311","die Kasse","Nomen","die","die Kassen","cash register / checkout","kahs-seh","Einkaufen, Geld & Konsum","","Bitte bezahlen Sie an der Kasse.","Please pay at the checkout."
"312","kaufen","Verb","","","to buy","kow-fen","Einkaufen, Geld & Konsum","verkaufen","Ich möchte ein neues Auto kaufen.","I want to buy a new car."
"313","kein","Andere","","","no / not a / none","kine","Grammatik, Pronomen & Struktur","ein","Wir haben keinen Zucker mehr zu Hause.","We have no sugar left at home."
"314","kennen","Verb","","","to know (a person or place)","ken-nen","Person, Familie & Beziehungen","","Kennst du diese Frau?","Do you know this woman?"
"315","kennenlernen","Verb","","","to get to know / to meet","ken-nen-lair-nen","Person, Familie & Beziehungen","","Ich möchte deine Familie kennenlernen.","I would like to get to know your family."
"316","das Kind","Nomen","das","die Kinder","child","kint","Person, Familie & Beziehungen","der Erwachsene","Das Kind spielt im Garten.","The child is playing in the garden."
"317","der Kindergarten","Nomen","der","die Kindergärten","kindergarten / preschool","kin-der-gar-ten","Ausbildung, Schule & Studium","","Mein Sohn geht in den Kindergarten.","My son goes to kindergarten."
"318","das Kino","Nomen","das","die Kinos","cinema / movie theater","kee-no","Freizeit, Hobbys & Unterhaltung","","Heute Abend gehen wir ins Kino.","Tonight we're going to the cinema."
"319","der Kiosk","Nomen","der","die Kioske","kiosk / newsstand","kee-osk","Einkaufen, Geld & Konsum","","Am Kiosk kaufe ich eine Zeitung.","At the kiosk I buy a newspaper."
"320","klar","Adjektiv","","","clear / sure / of course","klahr","Basiswortschatz & Floskeln","unklar","Ja klar, ich helfe dir gern.","Of course, I'm happy to help you."
"321","die Klasse","Nomen","die","die Klassen","class / grade","klahs-seh","Ausbildung, Schule & Studium","","In meiner Klasse sind zwanzig Schüler.","There are twenty students in my class."
"322","die Kleidung","Nomen","die","","clothing / clothes","kly-doong","Einkaufen, Geld & Konsum","","Im Winter brauche ich warme Kleidung.","In winter I need warm clothing."
"323","klein","Adjektiv","","","small / little","kline","Eigenschaften & Adjektive","groß","Wir wohnen in einer kleinen Wohnung.","We live in a small apartment."
"324","kochen","Verb","","","to cook","kokh-en","Essen, Kochen & Restaurant","","Am Wochenende koche ich gern.","On the weekend I like to cook."
"325","der Koffer","Nomen","der","die Koffer","suitcase","kof-fer","Reise, Verkehr & Mobilität","die Tasche","Mein Koffer ist sehr schwer.","My suitcase is very heavy."
"326","der Kollege","Nomen","der","die Kollegen","colleague (male)","kol-ley-geh","Arbeit, Beruf & Karriere","","Mein Kollege hilft mir bei der Arbeit.","My colleague helps me at work."
"327","kommen","Verb","","","to come","kom-men","Allgemeine Aktivitäten & Verben","gehen","Wann kommst du nach Hause?","When are you coming home?"
"328","das Konto","Nomen","das","die Konten","bank account","kon-toh","Einkaufen, Geld & Konsum","","Ich habe ein Konto bei dieser Bank.","I have an account at this bank."
"329","der Kopf","Nomen","der","die Köpfe","head","kopf","Gesundheit, Körper & Pflege","","Mein Kopf tut weh.","My head hurts."
"330","kosten","Verb","","","to cost","kos-ten","Einkaufen, Geld & Konsum","","Was kostet dieses Buch?","What does this book cost?"
"331","krank","Adjektiv","","","sick / ill","krahnk","Gesundheit, Körper & Pflege","gesund","Heute bin ich krank und bleibe im Bett.","Today I'm sick and stay in bed."
"332","kriegen","Verb","","","to get / to receive","kree-gen","Allgemeine Aktivitäten & Verben","geben","Zu Weihnachten kriege ich oft Bücher.","At Christmas I often get books."
"333","der Kuchen","Nomen","der","die Kuchen","cake","koo-khen","Essen, Kochen & Restaurant","","Meine Mutter backt einen Kuchen.","My mother is baking a cake."
"334","der Kugelschreiber","Nomen","der","die Kugelschreiber","ballpoint pen / pen","koo-gel-shry-ber","Ausbildung, Schule & Studium","der Bleistift","Mein Kugelschreiber schreibt nicht mehr.","My pen doesn't write anymore."
"335","kulturell","Adjektiv","","","cultural","kool-too-rel","Freizeit, Hobbys & Unterhaltung","","Die Stadt hat ein großes kulturelles Angebot.","The city has a large cultural offering."
"336","der Kunde","Nomen","der","die Kunden","customer / client","koon-deh","Einkaufen, Geld & Konsum","der Verkäufer","Der Kunde bezahlt mit Karte.","The customer pays by card."
"337","der Kurs","Nomen","der","die Kurse","course / class","koors","Ausbildung, Schule & Studium","","Mein Deutschkurs beginnt nächste Woche.","My German course begins next week."
"338","kurz","Adjektiv","","","short","koorts","Eigenschaften & Adjektive","lang","Wir machen eine kurze Pause.","We're taking a short break."
"339","können","Verb","","","can / to be able to","kern-nen","Allgemeine Aktivitäten & Verben","","Ich kann gut schwimmen.","I can swim well."
"340","die Küche","Nomen","die","die Küchen","kitchen","kue-kheh","Wohnen, Haus & Haushalt","","Unsere Küche ist klein, aber praktisch.","Our kitchen is small but practical."
"341","der Kühlschrank","Nomen","der","die Kühlschränke","refrigerator / fridge","kuel-shrahnk","Wohnen, Haus & Haushalt","der Herd","Die Milch ist im Kühlschrank.","The milk is in the fridge."
"342","lachen","Verb","","","to laugh","lah-khen","Gefühle, Charakter & Meinung","weinen","Die Kinder lachen laut.","The children are laughing loudly."
"343","der Laden","Nomen","der","die Läden","shop / store","lah-den","Einkaufen, Geld & Konsum","","Der Laden an der Ecke hat lange offen.","The shop on the corner is open late."
"344","das Land","Nomen","das","die Länder","country / land","lahnt","Basiswortschatz & Floskeln","die Stadt","Deutschland ist ein schönes Land.","Germany is a beautiful country."
"345","lang","Adjektiv","","","long","lahng","Eigenschaften & Adjektive","kurz","Der Film war sehr lang.","The movie was very long."
"346","lange","Andere","","","for a long time / long","lahng-eh","Uhrzeit, Datum & Kalender","kurz","Ich habe lange auf dich gewartet.","I waited a long time for you."
"347","langsam","Adjektiv","","","slow / slowly","lahng-zahm","Eigenschaften & Adjektive","schnell","Bitte sprich langsam!","Please speak slowly!"
"348","laufen","Verb","","","to walk / to run","low-fen","Allgemeine Aktivitäten & Verben","stehen","Jeden Morgen laufe ich im Park.","Every morning I run in the park."
"349","laut","Adjektiv","","","loud / noisy","lowt","Eigenschaften & Adjektive","leise","Die Musik ist mir zu laut.","The music is too loud for me."
"350","leben","Verb","","","to live","ley-ben","Allgemeine Aktivitäten & Verben","sterben","Meine Familie lebt in Österreich.","My family lives in Austria."
"351","das Leben","Nomen","das","die Leben","life","ley-ben","Basiswortschatz & Floskeln","der Tod","Das Leben in der Stadt ist teuer.","Life in the city is expensive."
"352","das Lebensmittel","Nomen","das","die Lebensmittel","food / grocery","ley-bens-mit-tel","Essen, Kochen & Restaurant","","Im Supermarkt kaufe ich frische Lebensmittel.","At the supermarket I buy fresh groceries."
"353","ledig","Adjektiv","","","single / unmarried","ley-dikh","Person, Familie & Beziehungen","verheiratet","Sind Sie verheiratet oder ledig?","Are you married or single?"
"354","legen","Verb","","","to lay / to put","ley-gen","Allgemeine Aktivitäten & Verben","nehmen","Leg das Buch auf den Tisch.","Put the book on the table."
"355","der Lehrer","Nomen","der","die Lehrer","teacher (male)","ley-rer","Ausbildung, Schule & Studium","der Schüler","Unser Lehrer ist sehr nett.","Our teacher is very nice."
"356","die Lehrerin","Nomen","die","die Lehrerinnen","teacher (female)","ley-rer-in","Ausbildung, Schule & Studium","die Schülerin","Meine Lehrerin kommt aus Berlin.","My teacher comes from Berlin."
"357","leicht","Adjektiv","","","light / easy","lykht","Eigenschaften & Adjektive","schwer","Die Tasche ist ganz leicht.","The bag is very light."
"358","leider","Andere","","","unfortunately","ly-der","Basiswortschatz & Floskeln","zum Glück","Leider habe ich heute keine Zeit.","Unfortunately, I have no time today."
"359","leise","Adjektiv","","","quiet / softly","ly-zeh","Eigenschaften & Adjektive","laut","Bitte sprich leise, das Baby schläft.","Please speak quietly, the baby is sleeping."
"360","lernen","Verb","","","to learn / to study","lair-nen","Ausbildung, Schule & Studium","verlernen","Ich lerne seit zwei Jahren Deutsch.","I've been learning German for two years."
"361","lesen","Verb","","","to read","ley-zen","Ausbildung, Schule & Studium","","Am Abend lese ich gern ein Buch.","In the evening I like to read a book."
"362","letzt-","Adjektiv","","","last","letst","Uhrzeit, Datum & Kalender","erst-","Letzte Woche war ich krank.","Last week I was sick."
"363","die Leute","Nomen","die","","people","loy-teh","Person, Familie & Beziehungen","","Auf dem Markt sind viele Leute.","There are many people at the market."
"364","das Licht","Nomen","das","die Lichter","light","likht","Wohnen, Haus & Haushalt","die Dunkelheit","Das Licht im Flur ist kaputt.","The light in the hallway is broken."
"365","lieb-","Adjektiv","","","dear / kind","leep","Gefühle, Charakter & Meinung","böse","Liebe Anna, wie geht es dir?","Dear Anna, how are you?"
"366","lieben","Verb","","","to love","lee-ben","Gefühle, Charakter & Meinung","hassen","Ich liebe meine Familie.","I love my family."
"367","lieber","Andere","","","rather / prefer to","lee-ber","Gefühle, Charakter & Meinung","","Ich trinke lieber Tee als Kaffee.","I prefer tea to coffee."
"368","das Lied","Nomen","das","die Lieder","song","leet","Freizeit, Hobbys & Unterhaltung","","Dieses Lied höre ich sehr gern.","I really like this song."
"369","liegen","Verb","","","to lie / to be located","lee-gen","Allgemeine Aktivitäten & Verben","stehen","Das Hotel liegt am See.","The hotel is located by the lake."
"370","links","Andere","","","left / on the left","links","Basiswortschatz & Floskeln","rechts","An der Ampel gehen Sie nach links.","At the traffic light you go left."
"371","der Lkw","Nomen","der","die Lkws","truck / lorry","el-kah-vey","Reise, Verkehr & Mobilität","der Pkw","Der Lkw steht vor dem Supermarkt.","The truck is parked in front of the supermarket."
"372","das Lokal","Nomen","das","die Lokale","pub / restaurant","lo-kahl","Essen, Kochen & Restaurant","","Dieses Lokal hat gutes Essen.","This restaurant has good food."
"373","lustig","Adjektiv","","","funny / fun","loos-tikh","Eigenschaften & Adjektive","traurig","Der Film war wirklich lustig.","The movie was really funny."
"374","die Lösung","Nomen","die","die Lösungen","solution","lur-zoong","Ausbildung, Schule & Studium","das Problem","Die Lösung der Aufgabe ist einfach.","The solution to the task is simple."
"375","machen","Verb","","","to do / to make","mah-khen","Allgemeine Aktivitäten & Verben","","Was machst du am Wochenende?","What are you doing on the weekend?"
"376","man","Andere","","","one / you (general)","mahn","Grammatik, Pronomen & Struktur","","Hier darf man nicht parken.","You're not allowed to park here."
"377","der Mann","Nomen","der","die Männer","man / husband","mahn","Person, Familie & Beziehungen","die Frau","Der Mann dort ist mein Vater.","The man over there is my father."
"378","die Maschine","Nomen","die","die Maschinen","machine","mah-shee-neh","Wohnen, Haus & Haushalt","","Die Maschine in der Fabrik ist laut.","The machine in the factory is loud."
"379","das Meer","Nomen","das","die Meere","sea / ocean","mair","Natur, Umwelt & Tiere","das Land","Im Urlaub fahren wir ans Meer.","On vacation we go to the sea."
"380","mehr","Andere","","","more","mair","Zahlen, Maße & Mengen","weniger","Ich brauche mehr Zeit.","I need more time."
"381","mein","Andere","","","my","mine","Grammatik, Pronomen & Struktur","dein","Das ist mein Bruder.","That's my brother."
"382","meist-","Andere","","","most","myst","Zahlen, Maße & Mengen","wenigst-","Die meisten Leute fahren mit dem Auto.","Most people go by car."
"383","der Mensch","Nomen","der","die Menschen","human / person","mensh","Person, Familie & Beziehungen","das Tier","Jeder Mensch ist anders.","Every person is different."
"384","die Miete","Nomen","die","die Mieten","rent","mee-teh","Wohnen, Haus & Haushalt","","Die Miete für die Wohnung ist hoch.","The rent for the apartment is high."
"385","mieten","Verb","","","to rent","mee-ten","Wohnen, Haus & Haushalt","vermieten","Wir möchten ein Auto mieten.","We would like to rent a car."
"386","die Milch","Nomen","die","","milk","milkh","Essen, Kochen & Restaurant","","Ich trinke jeden Morgen Milch.","I drink milk every morning."
"387","mit","Präposition","","","with","mit","Grammatik, Pronomen & Struktur","ohne","Ich fahre mit dem Zug nach Hause.","I'm going home by train."
"388","mitbringen","Verb","","","to bring along / to bring with","mit-bring-en","Allgemeine Aktivitäten & Verben","","Bring bitte etwas zu trinken mit.","Please bring something to drink."
"389","mitkommen","Verb","","","to come along / to come with","mit-kom-men","Allgemeine Aktivitäten & Verben","","Kommst du heute Abend mit?","Are you coming along tonight?"
"390","mitmachen","Verb","","","to participate / to join in","mit-mah-khen","Allgemeine Aktivitäten & Verben","","Möchtest du beim Spiel mitmachen?","Would you like to join in the game?"
"391","mitnehmen","Verb","","","to take along / to take with","mit-ney-men","Allgemeine Aktivitäten & Verben","dalassen","Nimm bitte einen Regenschirm mit.","Please take an umbrella with you."
"392","die Mitte","Nomen","die","die Mitten","middle / center","mit-teh","Basiswortschatz & Floskeln","der Rand","In der Mitte des Zimmers steht ein Tisch.","In the middle of the room there is a table."
"393","der Moment","Nomen","der","die Momente","moment","mo-ment","Basiswortschatz & Floskeln","","Im Moment habe ich leider keine Zeit.","At the moment I unfortunately have no time."
"394","morgen","Andere","","","tomorrow","mor-gen","Uhrzeit, Datum & Kalender","gestern","Morgen habe ich einen Termin beim Arzt.","Tomorrow I have a doctor's appointment."
"395","der Mund","Nomen","der","die Münder","mouth","moont","Gesundheit, Körper & Pflege","","Mach bitte den Mund auf.","Please open your mouth."
"396","die Mutter","Nomen","die","die Mütter","mother","moot-ter","Person, Familie & Beziehungen","der Vater","Meine Mutter arbeitet im Krankenhaus.","My mother works in a hospital."
"397","das Mädchen","Nomen","das","die Mädchen","girl","mait-khen","Person, Familie & Beziehungen","der Junge","Das Mädchen spielt mit der Puppe.","The girl is playing with the doll."
"398","männlich","Adjektiv","","","male / masculine","men-likh","Person, Familie & Beziehungen","weiblich","Ist das Wort männlich oder weiblich?","Is the word masculine or feminine?"
"399","die Möbel","Nomen","die","","furniture","mue-bel","Wohnen, Haus & Haushalt","","Wir kaufen neue Möbel für das Wohnzimmer.","We're buying new furniture for the living room."
"400","möchten","Verb","","","would like to","muekh-ten","Allgemeine Aktivitäten & Verben","","Ich möchte ein Glas Wasser, bitte.","I would like a glass of water, please."
"401","mögen","Verb","","","to like","mue-gen","Allgemeine Aktivitäten & Verben","hassen","Ich mag keinen Kaffee.","I don't like coffee."
"402","möglich","Adjektiv","","","possible","mueg-likh","Eigenschaften & Adjektive","unmöglich","Ist es möglich, den Termin zu ändern?","Is it possible to change the appointment?"
"403","müde","Adjektiv","","","tired","mue-deh","Eigenschaften & Adjektive","wach","Am Abend bin ich oft müde.","In the evening I'm often tired."
"404","müssen","Verb","","","must / to have to","mues-sen","Allgemeine Aktivitäten & Verben","dürfen","Ich muss jetzt nach Hause gehen.","I have to go home now."
"405","nach","Andere","","","to / after / past","nahkh","Grammatik, Pronomen & Struktur","vor","Nach dem Essen trinken wir Kaffee.","After the meal we drink coffee."
"406","der Name","Nomen","der","die Namen","name","nah-meh","Person, Familie & Beziehungen","","Wie ist Ihr Name, bitte?","What is your name, please?"
"407","nehmen","Verb","","","to take","ney-men","Allgemeine Aktivitäten & Verben","geben","Ich nehme den Bus zur Arbeit.","I take the bus to work."
"408","nein","Andere","","","no","nine","Basiswortschatz & Floskeln","ja","Nein, danke, ich möchte nichts.","No, thanks, I don't want anything."
"409","neu","Adjektiv","","","new","noy","Eigenschaften & Adjektive","alt","Ich habe ein neues Fahrrad.","I have a new bicycle."
"410","nicht","Andere","","","not","nikht","Grammatik, Pronomen & Struktur","doch","Heute regnet es nicht.","It's not raining today."
"411","nichts","Andere","","","nothing","nikhts","Grammatik, Pronomen & Struktur","alles","Ich habe heute noch nichts gegessen.","I haven't eaten anything yet today."
"412","nie","Andere","","","never","nee","Uhrzeit, Datum & Kalender","immer","Ich war noch nie in Paris.","I have never been to Paris."
"413","noch","Andere","","","still / yet / more","nokh","Basiswortschatz & Floskeln","schon","Hast du noch Hunger?","Are you still hungry?"
"414","normal","Adjektiv","","","normal","nor-mahl","Eigenschaften & Adjektive","unnormal","Das ist ganz normal.","That's completely normal."
"415","die Nummer","Nomen","die","die Nummern","number","noom-mer","Zahlen, Maße & Mengen","","Wie ist deine Telefonnummer?","What's your phone number?"
"416","nur","Andere","","","only / just","noor","Grammatik, Pronomen & Struktur","","Ich habe nur fünf Euro dabei.","I only have five euros with me."
"417","nächst-","Adjektiv","","","next","nekhst","Uhrzeit, Datum & Kalender","letzt-","Nächsten Montag fängt der Kurs an.","Next Monday the course starts."
"418","oben","Andere","","","upstairs / above","oh-ben","Wohnen, Haus & Haushalt","unten","Das Buch steht oben im Regal.","The book is up on the shelf."
"419","das Obst","Nomen","das","","fruit","ohpst","Essen, Kochen & Restaurant","das Gemüse","Ich esse jeden Tag Obst.","I eat fruit every day."
"420","oder","Andere","","","or","oh-der","Grammatik, Pronomen & Struktur","und","Möchtest du Tee oder Kaffee?","Would you like tea or coffee?"
"421","oft","Adverb","","","often","oft","Uhrzeit, Datum & Kalender","selten","Ich gehe oft ins Schwimmbad.","I often go to the swimming pool."
"422","ohne","Präposition","","","without","oh-neh","Grammatik, Pronomen & Struktur","mit","Ich trinke den Kaffee ohne Zucker.","I drink the coffee without sugar."
"423","die Oma","Nomen","die","die Omas","grandma / granny","oh-mah","Person, Familie & Beziehungen","der Opa","Meine Oma wohnt in einem Dorf.","My grandma lives in a village."
"424","der Opa","Nomen","der","die Opas","grandpa / granddad","oh-pah","Person, Familie & Beziehungen","die Oma","Mein Opa erzählt gern Geschichten.","My grandpa likes to tell stories."
"425","die Ordnung","Nomen","die","","order / tidiness","ort-noong","Basiswortschatz & Floskeln","die Unordnung","In meinem Zimmer ist immer Ordnung.","There is always order in my room."
"426","der Ort","Nomen","der","die Orte","place / town / location","ort","Basiswortschatz & Floskeln","","An diesem Ort war ich noch nie.","I have never been to this place."
"427","das Papier","Nomen","das","die Papiere","paper","pah-peer","Ausbildung, Schule & Studium","","Gib mir bitte ein Blatt Papier.","Please give me a sheet of paper."
"428","die Papiere","Nomen","die","","documents / papers","pah-pee-reh","Staat, Gesellschaft & Dokumente","","Bitte zeigen Sie mir Ihre Papiere.","Please show me your documents."
"429","der Partner","Nomen","der","die Partner","partner (male)","part-ner","Person, Familie & Beziehungen","","Mein Partner kocht heute das Abendessen.","My partner is cooking dinner today."
"430","die Partnerin","Nomen","die","die Partnerinnen","partner (female)","part-ner-in","Person, Familie & Beziehungen","","Seine Partnerin arbeitet als Ärztin.","His partner works as a doctor."
"431","die Party","Nomen","die","die Partys","party","par-tee","Freizeit, Hobbys & Unterhaltung","","Am Samstag mache ich eine Party.","On Saturday I'm having a party."
"432","der Pass","Nomen","der","die Pässe","passport","pahs","Staat, Gesellschaft & Dokumente","","Mein Pass ist noch zwei Jahre gültig.","My passport is valid for two more years."
"433","die Pause","Nomen","die","die Pausen","break / pause","pow-zeh","Arbeit, Beruf & Karriere","","Wir machen jetzt eine kurze Pause.","We're taking a short break now."
"434","der Plan","Nomen","der","die Pläne","plan / map","plahn","Reise, Verkehr & Mobilität","","Hast du einen Plan für heute Abend?","Do you have a plan for tonight?"
"435","der Platz","Nomen","der","die Plätze","seat / place / square","plahts","Basiswortschatz & Floskeln","","Auf dem Platz vor dem Rathaus ist ein Markt.","There is a market on the square in front of the town hall."
"436","die Polizei","Nomen","die","","police","po-lee-tsy","Staat, Gesellschaft & Dokumente","","Bei einem Unfall rufe ich die Polizei.","In an accident I call the police."
"437","die Pommes frites","Nomen","die","","French fries","pom freet","Essen, Kochen & Restaurant","","Die Kinder essen gern Pommes frites.","The children like to eat French fries."
"438","die Post","Nomen","die","","post office / mail","post","Kommunikation, Medien & Sprache","","Ich bringe den Brief zur Post.","I'm taking the letter to the post office."
"439","die Postleitzahl","Nomen","die","die Postleitzahlen","postal code / zip code","post-lyte-tsahl","Kommunikation, Medien & Sprache","","Wie ist die Postleitzahl von Berlin?","What is the postal code of Berlin?"
"440","das Praktikum","Nomen","das","die Praktika","internship / practical training","prahk-tee-koom","Arbeit, Beruf & Karriere","","Im Sommer mache ich ein Praktikum.","In summer I'm doing an internship."
"441","die Praxis","Nomen","die","die Praxen","doctor's office / practice","prahk-sis","Gesundheit, Körper & Pflege","die Theorie","Die Praxis ist heute geschlossen.","The doctor's office is closed today."
"442","der Preis","Nomen","der","die Preise","price","price","Einkaufen, Geld & Konsum","","Der Preis für das Zimmer ist gut.","The price for the room is good."
"443","das Problem","Nomen","das","die Probleme","problem","pro-bleym","Basiswortschatz & Floskeln","die Lösung","Kein Problem, ich helfe dir.","No problem, I'll help you."
"444","der Prospekt","Nomen","der","die Prospekte","brochure / leaflet","pros-pekt","Reise, Verkehr & Mobilität","","Im Prospekt steht der Preis.","The price is in the brochure."
"445","die Prüfung","Nomen","die","die Prüfungen","exam / examination / test","prue-foong","Ausbildung, Schule & Studium","","Morgen habe ich eine wichtige Prüfung.","Tomorrow I have an important exam."
"446","pünktlich","Adjektiv","","","punctual / on time","puenkt-likh","Uhrzeit, Datum & Kalender","unpünktlich","Der Zug kommt heute pünktlich.","The train arrives on time today."
"447","rauchen","Verb","","","to smoke","row-khen","Allgemeine Aktivitäten & Verben","","Hier dürfen Sie nicht rauchen.","You're not allowed to smoke here."
"448","der Raum","Nomen","der","die Räume","room / space","rowm","Ausbildung, Schule & Studium","","Wir treffen uns im Raum zwölf.","We're meeting in room twelve."
"449","die Rechnung","Nomen","die","die Rechnungen","bill / check / invoice","rekh-noong","Essen, Kochen & Restaurant","","Die Rechnung, bitte!","The bill, please!"
"450","rechts","Andere","","","right / on the right","rekhts","Basiswortschatz & Floskeln","links","Das Bad ist die zweite Tür rechts.","The bathroom is the second door on the right."
"451","der Regen","Nomen","der","","rain","rey-gen","Natur, Umwelt & Tiere","die Sonne","Bei Regen bleibe ich lieber zu Hause.","When it rains I prefer to stay at home."
"452","regnen","Verb","","","to rain","reyg-nen","Natur, Umwelt & Tiere","","Es regnet seit gestern ohne Pause.","It has been raining since yesterday without a break."
